Influencer,insta_id,username,bio,category,is_verified,is_professionalAccount,followers,following,posts_count,post1,post2,post3,post4,post5,post6,post7,post8,post9,post10,post11,post12,primary_niche,highest_post,gender_demographics,avg_likes_computed,avg_comments_computed,engagement_score,engagement_per_follower,follower_ratio,estimated_reach,estimated_impression,reach_ratio
Virat Kohli,virat.kohli,virat.kohli,Carpediem!,Athlete,TRUE,TRUE,269970622,279,1217,"{""mediaType"": 2, ""likeCount"": 599151, ""commentCount"": 5675, ""commentText"": ""Open your NR account in just 4 hours with HSBC\u2019s NRI services and transfer money fee free* with your HSBC India Mobile Banking app.\u00a0\n\nTo open your NRI Account with HSBC click here\u2013\u00a0https://grp.hsbc/vk_nr\n\n*T&C Apply. Visit\u00a0www.hsbc.co.in\u00a0for more details.\n\u00a0\n#HSBCNRIServices #HSBCIndia #OpeningUpAWorldOfOpportunity"", ""viewCount"": 9453607, ""location"": null, ""userTags"": [""hsbc_in""]}","{""mediaType"": 2, ""likeCount"": 631085, ""commentCount"": 6234, ""commentText"": ""Super proud to announce that O\u2019cean Energy Drink Sustainable Edition bagged the \u2018Best Brand Extension\u2019 award at the Global Water Congress 2024. \ud83c\udf0d\u267b\ufe0f This fully recyclable can, created in partnership with @ballcorporation , is a reassuring nod to O\u2019cean Beverages\u2019 commitment to ecologically conscious production methods and a more sustainable future. @oceanbeverages\nTo celebrate this win, we\u2019re giving you the energy drink at 50% off for a limited time only. Order yours today on oceanbeverages.in. \n\n#OceanEnergyDrink #ocean #RecyclesForever #SustainableLiving #oceanbeverages #EnergyDrink #plantbased #sustainable"", ""viewCount"": 12095143, ""location"": null, ""userTags"": [""ballcorporation"", ""oceanbeverages""]}","{""mediaType"": 2, ""likeCount"": 586993, ""commentCount"": 3251, ""commentText"": ""Proud of my team, @team_bluerising, for an outstanding start to @e1series Season 2\u2014winning the first final heat and securing third in the second. A solid performance in the world\u2019s first all-electric raceboat championship.\n\nAfter a podium finish at the #JeddahGP, we are driven to keep the momentum going for the rest of the season.\nUp next: Race 02\nE1 DOHA GP\n21-22 February\nLet\u2019s get another podium finish @saramisir @guedo.499!\n#TeamBlueRising #Season2 #OceanRacing #TEAMOWNER #PAIDPARTNERSHIP"", ""viewCount"": 10830871, ""location"": null, ""userTags"": [""saramisir"", ""virat.kohli"", ""e1series"", ""guedo.499"", ""adikmishra""]}","{""mediaType"": 2, ""likeCount"": 404887, ""commentCount"": 4252, ""commentText"": ""Jab crunchy snacking ka mood ho, toh le aao no palm oil wala Too Yumm! Karare Munchy Masala. \ud83d\ude0b\nGet yours now at your nearest stores or on leading e-commerce platforms! \ud83d\uded2\n\n#TooYumm #TooYummKarare #TooNahiTohKuchNahi #Masaledaar #BakedNotFried #NoPalmOil #GreatTaste"", ""viewCount"": 10139464, ""location"": null, ""userTags"": [""tooyumm""]}","{""mediaType"": 2, ""likeCount"": 467386, ""commentCount"": 5418, ""commentText"": ""I am ready for an exclusive travel experience with my HSBC TravelOne Credit Card. Are you?\u00a0\nEarn\u00a0up to 2X reward points* on international spends, unlock attractive welcome benefits and get international & domestic lounge access - only with the HSBC TravelOne Credit Card.\u00a0\n\nGet your card now! Apply now -\u00a0https://grp.hsbc/vk_t1\nFor persons in India. Terms and\u00a0Conditions Apply.\n\n#HSBC #HSBCTravelOneCreditCard #OpeningUpAWorldOfOpportunity #PackYourPerks #TravelWithVirat #CreditCardPerks #TravelInStyle #HSBCCreditCard #BankSmartWithHSBC"", ""viewCount"": 11146665, ""location"": null, ""userTags"": [""hsbc_in""]}","{""mediaType"": 8, ""likeCount"": 795566, ""commentCount"": 7558, ""commentText"": ""Do you know O\u2019cean has so many amazing fruit flavours to choose from? Do you also know you can now scan the QR code on the bottle to get your hands on super cool prizes? What you waiting for? Quick, pick your flavour to hydrate, scan and win. @oceanbeverages\u2028Available at your nearest stores, leading e-commerce platforms, and on www.oceanbeverages.in.\ud83d\uded2\u00a0@oceanbeverages\u00a0\n\u2028#Win\u00a0#Ocean\u00a0#OceanBeverages\u00a0#OceanFruitWater\u00a0#Hydration\u00a0#SupremeHydration\u00a0#OceanDrinks\u00a0#FruitWater\u00a0#NaturalFlavours\u00a0#ad"", ""viewCount"": 0, ""location"": null, ""userTags"": [""oceanbeverages""]}","{""mediaType"": 1, ""likeCount"": 600150, ""commentCount"": 6676, ""commentText"": ""Too Yumm! Karare \u2014 har crunch mein masaledaar punch! \ud83d\udc4a Baked, not fried, with zero palm oil and 100% great taste\u2014so you can snack without a second thought! \ud83d\ude4c\nGet yours now at your nearest stores or on leading e-commerce platforms! \ud83d\uded2\n\n#TooYumm #TooYummKarare #TooNahiTohKuchNahi #Masaledaar #BakedNotFried #NoPalmOil #GreatTaste"", ""viewCount"": 0, ""location"": null, ""userTags"": [""tooyumm""]}","{""mediaType"": 1, ""likeCount"": 527175, ""commentCount"": 5174, ""commentText"": ""When Too Yumm! Multigrain Chips and Veggie Stix are baked, not fried, why feel guilty? \ud83d\ude0b With no palm oil & masaledaar flavour, it\u2019s the ultimate snack to munch on! \ud83d\udd25\nGrab yours now at your nearest stores and leading e-commerce platforms\u2014because good vibes (and snacks) shouldn\u2019t wait! \ud83d\ude80\n\n#TooYumm #TooNahiTohKuchNahi #MultigrainChips #VeggieStix #TooYummMultigrainChips #TooYummVeggieStix #Masaledaar #Crunchy #NoPalmOil"", ""viewCount"": 0, ""location"": null, ""userTags"": [""tooyumm""]}","{""mediaType"": 2, ""likeCount"": 650795, ""commentCount"": 7510, ""commentText"": ""Grab O\u2019cean\u2019s new Green Apple flavour\u2014small in size, big on taste and Vitamin C! Scan the QR code on the label and you could have a chance to win some exclusive O\u2019cean merch and other amazing prizes. Go and order now!\ud83c\udf4f @oceanbeverages\u2028Available at your nearest stores, leading e-commerce platforms, and on www.oceanbeverages.in.\ud83d\uded2\n\n#Ocean #OceanBeverages #OceanFruitWater #Hydration #SuperHydration #OceanDrinks #FruitWater #NaturalFlavours #NewFlavour #GreenApple #ad"", ""viewCount"": 12120669, ""location"": null, ""userTags"": [""oceanbeverages""]}","{""mediaType"": 2, ""likeCount"": 768499, ""commentCount"": 9738, ""commentText"": ""Did you know your body gets just as dehydrated in winter as it does in summer? Which is why you need vitamin C and electrolyte packed O\u2019cean Fruit Water. Amazing fruity flavours. Now with amazing prizes too.\u2028Available at your nearest stores, leading e-commerce platforms, and on www.oceanbeverages.in.\ud83d\uded2\u00a0@oceanbeverages \u2028#Win\u00a0#Ocean\u00a0#OceanBeverages\u00a0#OceanFruitWater\u00a0#Hydration\u00a0#SupremeHydration\u00a0#OceanDrinks\u00a0#FruitWater\u00a0#NaturalFlavours\u00a0#ad"", ""viewCount"": 14032444, ""location"": null, ""userTags"": [""oceanbeverages""]}","{""mediaType"": 2, ""likeCount"": 717980, ""commentCount"": 15003, ""commentText"": ""My favourite O\u2019cean Fruit Water now comes with exciting giveaways. Drink O\u2019cean Fruit Water, scan the QR code and see what cool stuff you get. \n.\nAvailable at your nearest stores, leading e-commerce platforms, and on www.oceanbeverages.in. \ud83d\uded2 @oceanbeverages \n#Win #Ocean #OceanBeverages #OceanFruitWater #Hydration #SupremeHydration #OceanDrinks #FruitWater #NaturalFlavours #ad"", ""viewCount"": 14711355, ""location"": null, ""userTags"": [""oceanbeverages""]}","{""mediaType"": 2, ""likeCount"": 1067810, ""commentCount"": 12467, ""commentText"": ""Your phones and laptops have super chargers these days. But here\u2019s the best way to get super charged up yourself. O\u2019cean Energy Drink is a burst of plant-based energy to help you zip through your day. Grab an infinitely recyclable O\u2019cean Energy Drink can by Ball and power up with plant-based energy! \nNow at 50% off for a limited time\u2014only at www.oceanbeverages.in. Don\u2019t miss out! \n@oceanbeverages @ballcorporation\n.\n.\n#RecyclesForever #SustainableLiving #oceanbeverages #EnergyDrink #plantbased #sustainable"", ""viewCount"": 17606332, ""location"": null, ""userTags"": [""ballcorporation"", ""oceanbeverages""]}",technology,"{""mediaType"": 2, ""likeCount"": 599151, ""commentCount"": 5675, ""commentText"": ""Open your NR account in just 4 hours with HSBC\u2019s NRI services and transfer money fee free* with your HSBC India Mobile Banking app.\u00a0\n\nTo open your NRI Account with HSBC click here\u2013\u00a0https://grp.hsbc/vk_nr\n\n*T&C Apply. Visit\u00a0www.hsbc.co.in\u00a0for more details.\n\u00a0\n#HSBCNRIServices #HSBCIndia #OpeningUpAWorldOfOpportunity"", ""viewCount"": 9453607, ""location"": null, ""userTags"": [""hsbc_in""]}","Male: 60.76%, Female: 39.24%",651456.4167,7413,458243.3917,0.002440523,967636.638,3212799141,4819198712,11.90055095
Bhuvan Bam,bhuvan.bam22,bhuvan.bam22,New BB Ki Vines Episode⬇️,Artist,TRUE,TRUE,20640758,275,1695,"{""mediaType"": 2, ""likeCount"": 2780615, ""commentCount"": 11959, ""commentText"": ""I LOVE YOU PUNE\u2665\ufe0f Agli baar behtar tayaari ke saath aaunga. Sorry if anybody got hurt. \ud83d\ude4f\ud83c\udffc\n\n#TaazaKhabarS2 #Pune\n\nedit: @geetika.bbian"", ""viewCount"": 31585440, ""location"": {""name"": ""Pune, India"", ""address"": """", ""city"": """", ""has_viewer_saved"": false, ""pk"": 114097239435081, ""short_name"": ""Pune"", ""facebook_places_id"": 114097239435081, ""external_source"": ""facebook_places"", ""lng"": 73.901603333333, ""lat"": 18.553111666667}, ""userTags"": [""jiohotstar"", ""bbkvproductions""]}","{""mediaType"": 2, ""likeCount"": 683592, ""commentCount"": 11621, ""commentText"": ""Karza aur gunah chukaane padhte hain! Kabhi kabhi marr ke bhi..\n \n#HotstarSpecials #TaazaKhabar Season 2 streaming from September 27 on @disneyplushotstar\n \n#TaazaKhabarOnHotstar\n\n@bhuvan.bam22 @shriya.pilgaonkar @jaavedjaaferi @prathameshparab @devenbhojani.official @nitspits @maheshmanjrekar #ShilpaShukla @rohitonweb @himank.gaur @abbasdalal @hussain.dalal @arvin.bhandari @remydalai @thatbosswoman @4cut_aatmaram_  @navrattan27 @shivangiishrivastav @tariqueumarkhan @safirock @akshayraheja @rajarshisanyal @omkartamhan @justinjosecas @musicalsaurabh @jarvisintune @payalbhatiamua @sidrath18"", ""viewCount"": 12263839, ""location"": null, ""userTags"": []}","{""mediaType"": 2, ""likeCount"": 2276653, ""commentCount"": 21958, ""commentText"": ""Wait..WHAT? \ud83d\ude31\n\n#DhindoraSeason2 #9YearsOfBBKiVines"", ""viewCount"": 30796042, ""location"": null, ""userTags"": [""bbkvproductions"", ""savagetitu""]}","{""mediaType"": 1, ""likeCount"": 1278031, ""commentCount"": 4395, ""commentText"": ""Kaam jaari kyunki kaam bhaari \ud83d\ude4f\ud83c\udffc\ud83d\ude0f\n\n\ud83e\uddbe: @fitnesstalks_with_pranit"", ""viewCount"": 0, ""location"": null, ""userTags"": []}","{""mediaType"": 2, ""likeCount"": 1642353, ""commentCount"": 20840, ""commentText"": ""Happy Anniversary Aai Baba. \u2665\ufe0f\nAlways wanted to give you the best life. I hope to fulfill the promise in the next birth. Each day serves as a reminder of how unfair life can be.\nSee you on the other side. \ud83e\udec2"", ""viewCount"": 14753770, ""location"": null, ""userTags"": []}","{""mediaType"": 1, ""likeCount"": 1110173, ""commentCount"": 4440, ""commentText"": ""Selfie after ages. Shirt mast hai na? \ud83c\udf3b"", ""viewCount"": 0, ""location"": null, ""userTags"": []}","{""mediaType"": 8, ""likeCount"": 1258811, ""commentCount"": 2941, ""commentText"": ""Dressed up for the Big Day! \ud83d\ude0e\ud83d\udd25"", ""viewCount"": 0, ""location"": null, ""userTags"": [""sahil_anand_arora"", ""shivamguptax15"", ""nm_design_studio"", ""pellesantino"", ""robertson_lyngdoh_"", ""rajsingh8581"", ""dhruvmungiya""]}","{""mediaType"": 2, ""likeCount"": 205733, ""commentCount"": 1049, ""commentText"": ""Khushi, Muskaan aur Jannat ko bhool jaao, kyunki @peppy4all kaafi hai. They say happiness is round the corner, but peppy brings it closer to you! \ud83d\ude09\ud83d\udc95\n#BBxPeppy #ad"", ""viewCount"": 4274013, ""location"": null, ""userTags"": [""peppy4all""]}","{""mediaType"": 8, ""likeCount"": 1338289, ""commentCount"": 2895, ""commentText"": ""Me and my Rick & Morty socks \ud83d\udd25\ud83d\ude0e"", ""viewCount"": 0, ""location"": null, ""userTags"": []}","{""mediaType"": 2, ""likeCount"": 2721361, ""commentCount"": 3696, ""commentText"": ""Sach baat hai ki nahi? \ud83e\udee0"", ""viewCount"": 24228479, ""location"": null, ""userTags"": []}","{""mediaType"": 8, ""likeCount"": 2567897, ""commentCount"": 3125, ""commentText"": ""Malviya Nagar se KBC !! \ud83e\udd79\u2665\ufe0f Catch me and my amazing friends on the special episode of \u2018Kaun Banega Crorepati\u2019 airing tonight at 9pm on @sonylivindia and @sonytvofficial \n\nHey tumchya sathi Aai Baba\u2665\ufe0f\n\n#BBxBigB #kbc"", ""viewCount"": 0, ""location"": null, ""userTags"": [""tanmaybhat"", ""kamiya_jani"", ""amitabhbachchan"", ""maisamayhoon""]}","{""mediaType"": 8, ""likeCount"": 1268621, ""commentCount"": 2907, ""commentText"": ""Naya saal, naye baal \ud83d\udd25\ud83e\udee0"", ""viewCount"": 0, ""location"": null, ""userTags"": []}",technology,"{""mediaType"": 2, ""likeCount"": 2780615, ""commentCount"": 11959, ""commentText"": ""I LOVE YOU PUNE\u2665\ufe0f Agli baar behtar tayaari ke saath aaunga. Sorry if anybody got hurt. \ud83d\ude4f\ud83c\udffc\n\n#TaazaKhabarS2 #Pune\n\nedit: @geetika.bbian"", ""viewCount"": 31585440, ""location"": {""name"": ""Pune, India"", ""address"": """", ""city"": """", ""has_viewer_saved"": false, ""pk"": 114097239435081, ""short_name"": ""Pune"", ""facebook_places_id"": 114097239435081, ""external_source"": ""facebook_places"", ""lng"": 73.901603333333, ""lat"": 18.553111666667}, ""userTags"": [""jiohotstar"", ""bbkvproductions""]}","Male: 66.35%, Female: 33.65%",1594344.083,7652.166667,1118336.508,0.077613247,75057.30182,980107955.8,1470161934,47.48410673
Rashmika Mandanna,rashmika_mandanna,rashmika_mandanna,Kindness before all 🌻🧡✨,Artist,TRUE,TRUE,45250776,321,758,"{""mediaType"": 2, ""likeCount"": 530875, ""commentCount"": 2034, ""commentText"": ""I know I am late, but there are so many photos and videos from Chhaava promotions that I still haven\u2019t shared.. \nand I have to share them now.. I hope that\u2019s ok. \ud83d\ude48\u2764\ufe0f\ud83e\udd17\nOkieee this is the video of lewk 1 from this super special day, one day before the release and all of you witnessing Chhaava come alive..\ud83d\udc12\u2764\ufe0f"", ""viewCount"": 6473425, ""location"": null, ""userTags"": []}","{""mediaType"": 8, ""likeCount"": 478194, ""commentCount"": 1503, ""commentText"": ""Kindness is truly in the tiny little things. Sometimes it\u2019s in the smile, sometimes in the words you use, sometimes in your actions and sometimes it\u2019s in the silence.. \ud83c\udf3b\u2728\ud83e\udd0d\nWhat\u2019s your #kindful language? \ud83c\udf3b\ud83e\udd70\n\n#RnR #Rashmika&Ru #TTTRashmika"", ""viewCount"": 0, ""location"": null, ""userTags"": [""ttt_official""]}","{""mediaType"": 1, ""likeCount"": 1093916, ""commentCount"": 5978, ""commentText"": ""Hey there. \u2764\nHow does this crown look? \ud83d\ude48\ud83d\ude1a"", ""viewCount"": 0, ""location"": null, ""userTags"": []}","{""mediaType"": 8, ""likeCount"": 265332, ""commentCount"": 717, ""commentText"": ""\""Destiny played a huge role in bringing me...\""\n\nOur February cover star Rashmika Mandanna (@rashmika_mandanna) has gone from being the 'National Crush' to being a 'National Treasure!' \ud83c\udfac\n\nHow does she stay grounded? What does she make of her dizzying rise? How does she see her career evolving?\n\n\""There\u2019s Kubera, an incredibly intriguing project! Working with Dhanush sir has...\u201d said Rashmika in a candid chat with Masala! \u2728\n\nRead the full story on masala.com\n\nLink in the bio \ud83d\udd17\n\nWords by: Mohan Sridhara (@mysorewalamasala)\n\n\u2014\u2014\u2014\u2014\u2014\u2014\u2014\u2014\u2014\u2014\u2014\u2014\u2014\u2014\u2014\u2014\u2014\u2014\u2014\u2014\u2014\u2014\u2014\n\nPhotographer - Vaishnav Praveen \nHair - Mike Desir\nMakeup - Riddhima Sharma\nStyling - Stacey Cardoz\nArtist Reputation Management: @spicesocial\nCover Design: @santoshkamble19800"", ""viewCount"": 0, ""location"": null, ""userTags"": [""rashmika_mandanna""]}","{""mediaType"": 8, ""likeCount"": 2111426, ""commentCount"": 5726, ""commentText"": ""Maharani Yesubai.\u00a0\n\nI am a better writer than a speaker, so here goes. \u2764\ufe0f\nI had watched the film called mimi and I loved the film so much that I wanted to invite Laxman sir for the screening of my film goodbye and so i messaged him and that\u2019s when the journey began Cz sir immediately asked me if he could call me and we spoke and he was telling me he wanted to meet me for his next film.. and I thought he was just being nice, but the meeting actually did happen, and it made me so so so happy that it did happen.. I truly thank the universe for this.\u00a0\n\nI didn\u2019t know what the story was. I didn\u2019t know why they came to me, I didn\u2019t know how they even saw me as the maharani. I didn\u2019t even know what was happening.. when i actually heard the narration i was confused, shocked but also so grateful, overwhelmed and so so so happy that I didnt know how to react because I didn\u2019t know how we were going to achieve this.\u00a0\n\nA girl from the south playing Maharani Yesubai.\u00a0\nThat was something I never had on my radar.. never thought it was possible, and that\u2019s why I love working with people who give us the hope to dream beyond boundaries.\n\nAnd then the maharani came in all her glory.\u00a0\nShe is fierce - she is powerful - she is graceful - she is a true queen.\u00a0\nHer love is the love I truly relate to - it\u2019s so pure so divine and so respectful and so true that Maharaj and Maharani are always connected beyond just words."", ""viewCount"": 0, ""location"": null, ""userTags"": [""priyanka.s.borkar"", ""parthmangla"", ""vickykaushal09"", ""tanvichemburkar"", ""vardannayak"", ""saibabu2223"", ""laxman.utekar"", ""souravv_roy_""]}","{""mediaType"": 8, ""likeCount"": 1767604, ""commentCount"": 2070, ""commentText"": ""Laxman sir is so busy with all the editing and all of the serious film work and so Vicky and I thought we\u2019ll kidnap him and do off a mini photoshoot.. \ud83d\ude0b\ud83d\udc12 and after that we ended up doing our lil shoot to tell you guys that- \u2018Chhaava is coming out in 3 days and we are so so excitedddd!\u2019 \ud83d\udc9b\ud83d\udc83\ud83c\udffb\ud83d\udd7a\ud83c\udffb\n\n#Chhaava"", ""viewCount"": 0, ""location"": null, ""userTags"": [""vickykaushal09"", ""_psudo_"", ""laxman.utekar""]}","{""mediaType"": 2, ""likeCount"": 88188, ""commentCount"": 461, ""commentText"": ""Scooch over, besties! I\u2019m bringing my sunshine, my little ball of joy, my Ru to you \u2013 because happiness is best when shared, no? And we\u2019re coming soon to spread that joy your way!!! \ud83d\udc9b\ud83c\udf3b\u00a0\n\n#RnR #Rashmika&Ru\u00a0#TTTRashmika"", ""viewCount"": 4717850, ""location"": null, ""userTags"": [""rashmika_mandanna""]}","{""mediaType"": 8, ""likeCount"": 2377520, ""commentCount"": 2437, ""commentText"": ""4 days to go #Chhaava \ud83d\udd25\u2764\ufe0f\n@vickykaushal09"", ""viewCount"": 0, ""location"": null, ""userTags"": []}","{""mediaType"": 2, ""likeCount"": 103778, ""commentCount"": 980, ""commentText"": ""Skincare that works for me. \ud83e\ude77 @cetaphil_india has been a part of my routine for a while now, and the Bright Healthy Radiance range fits right in. It helps me care for my skin without any fuss\u2014just the way I like it. \u263a\n\n#partnership"", ""viewCount"": 2872096, ""location"": null, ""userTags"": [""cetaphil_india""]}","{""mediaType"": 8, ""likeCount"": 1194271, ""commentCount"": 4010, ""commentText"": ""Kindness is so underrated these days. \ud83e\udd0d\ud83c\udf3b\nI choose kindness and everything that comes with it. \ud83e\udd0d\nLet\u2019s all be kind to each other \u2764\ufe0f"", ""viewCount"": 0, ""location"": null, ""userTags"": []}","{""mediaType"": 2, ""likeCount"": 116941, ""commentCount"": 795, ""commentText"": ""Excited to bring some color to your world with Naye Zamane Ka Naya Paint\u2014@BirlaOpus! \ud83c\udfa8\u2728\n\nSay goodbye to damp walls and hello to stunning, long-lasting beauty. Time for a vibrant change, what do you think? \ud83d\udcab\n\n#NayeZamaneKaNayaPaint #BirlaOpusPaints #OneExteriors #DuniyaKoRangDo #partnership"", ""viewCount"": 4771301, ""location"": null, ""userTags"": [""birlaopus""]}","{""mediaType"": 8, ""likeCount"": 1388616, ""commentCount"": 1958, ""commentText"": ""\u092e\u0939\u0930\u093e\u091c\u0964\ud83d\ude4f\n\n\u092d\u094b\u0938\u0932\u0947 \u092a\u0930\u093f\u0935\u093e\u0930 \u0915\u093e \u0939\u0930 \u092a\u0941\u0930\u0941\u0937 \u092a\u0939\u093e\u0921\u093c\u0940 \u0924\u0942\u092b\u093e\u0928 \u0939\u0948\u0964\n\nYou as Vicky Kaushal and as Raaje are most definitely a toofan. \ud83d\ude4f\ud83c\udffb\ud83e\udd17\n\nYou truly have a way of making all of us feel very special. \nIt was so lovely to have you in Hyderabad.. and next time please do allow me to host you properly. \ud83d\ude01\ud83e\udd17\nI am so sorry I am not in my best capacity to run around supporting you with the promotions but i promise you I will do my best. \ud83d\ude01\ud83e\udd17\n\n@vickykaushal09 \n#Chhaava"", ""viewCount"": 0, ""location"": null, ""userTags"": [""vickykaushal09"", ""_psudo_""]}",technology,"{""mediaType"": 2, ""likeCount"": 530875, ""commentCount"": 2034, ""commentText"": ""I know I am late, but there are so many photos and videos from Chhaava promotions that I still haven\u2019t shared.. \nand I have to share them now.. I hope that\u2019s ok. \ud83d\ude48\u2764\ufe0f\ud83e\udd17\nOkieee this is the video of lewk 1 from this super special day, one day before the release and all of you witnessing Chhaava come alive..\ud83d\udc12\u2764\ufe0f"", ""viewCount"": 6473425, ""location"": null, ""userTags"": []}","Male: 31.60%, Female: 68.40%",959721.75,2389.083333,672521.95,0.021261753,140968.1495,1280087309,1920130963,28.28873717
