Influencer,insta_id,username,bio,category,is_verified,is_professionalAccount,followers,following,posts_count,post1,post2,post3,post4,post5,post6,post7,post8,post9,post10,post11,post12,primary_niche,highest_post,gender_demographics,avg_likes_computed,avg_comments_computed,engagement_score,engagement_per_follower,follower_ratio,estimated_reach,estimated_impression,reach_ratio
Ranveer Allahbadia,beerbiceps,beerbiceps,peace & growth,Entrepreneur,TRUE,TRUE,4523949,3366,2395,"{""mediaType"": 1, ""likeCount"": 776440, ""commentCount"": 38494, ""commentText"": ""N/A"", ""viewCount"": 0, ""location"": null, ""userTags"": [""ranveerallahbadia""]}","{""mediaType"": 2, ""likeCount"": 1620068, ""commentCount"": 255123, ""commentText"": ""I shouldn\u2019t have said what I said on India\u2019s got latent. I\u2019m sorry."", ""viewCount"": 57462886, ""location"": null, ""userTags"": [""ranveerallahbadia""]}","{""mediaType"": 1, ""likeCount"": 185437, ""commentCount"": 4428, ""commentText"": ""India's most networked man. And by his side...\n\nRajeev Shukla Ji \u263a\ufe0f\n\nPodcast with the coolest big bro in town is now live on @theranveershowpodcast \n\nToo much fun with @rajeevshuklaoffl"", ""viewCount"": 0, ""location"": null, ""userTags"": [""rajeevshuklaoffl""]}","{""mediaType"": 8, ""likeCount"": 265849, ""commentCount"": 1879, ""commentText"": ""Break time England dump...\n\nOnly 3 episodes recorded in 14 days. \n\nThe rest of the time was spent resting up for 2025.\n\nHere's an excess of photos for the sake of vibes.\n\nThis country has started to feel like a 2nd home.\n\nComing to chill with you, Virat Kohli.\n\nLove you @manchesterunited.\n\nThanks for the memories.\n\n2025 will now be aced.\n\n\ud83c\uddec\ud83c\udde7\u2665\ufe0f\ud83c\uddee\ud83c\uddf3\ud83c\udff9"", ""viewCount"": 0, ""location"": {""name"": ""United Kingdom"", ""address"": """", ""city"": """", ""has_viewer_saved"": false, ""pk"": 402650680163034, ""short_name"": ""United Kingdom"", ""facebook_places_id"": 402650680163034, ""external_source"": ""facebook_places"", ""lng"": -0.12894783631106, ""lat"": 51.507445471441}, ""userTags"": [""watkinsbooks"", ""akshattiiwari"", ""wes_brown24""]}","{""mediaType"": 8, ""likeCount"": 307200, ""commentCount"": 0, ""commentText"": ""Shot a stunning, heartfelt & impactful documentary at @vantara in Jamnagar. These were some of our most memorable moments.\n\nEvery year, @teambeerbiceps chooses to take on a few projects beyond podcasting. These are projects chosen for the sake of societal impact.\n\nWildlife has been a huge passion of mine since childhood. Honoured to have spent time with the iconic wildlife conservationist @forrest.galante. He helped us understand the animals and their reality in Vantara. \n\nDeeply moved by everything we saw. Hope you feel the same emotions we felt. One of our most healing pieces of work \u2764\ufe0f\u200d\ud83e\ude79\n\nShoutout to @dash_trapicals, the editor of the documentary. Graduate from @beerbiceps_skillhouse.\n\nShoutout to @vivaank3 for making this happen.\n\nGo watch this doc on our YouTube channel, @beerbiceps \n\n#Wildlife #wildlifeconservation #vantara"", ""viewCount"": 0, ""location"": null, ""userTags"": [""ranveerallahbadia"", ""vantara""]}","{""mediaType"": 8, ""likeCount"": 105948, ""commentCount"": 566, ""commentText"": ""One of modern day football's icons - @ilkayguendogan appears on an Indian podcast \ud83c\uddee\ud83c\uddf3\ud83c\uddee\ud83c\uddf3\ud83c\uddee\ud83c\uddf3\n\nIn my eyes, this one is for INDIAN FOOTBALL. Hope this conversation furthers football culture in our beautiful country.\n\nBut of course, if you're a fan of European football, like so many of us... this conversation is a deep dive into the mind of a world class baller.\n\nGermany national team captain.\nMan City, Borussia Dortmund & FC Barcelona Legend.\nChampions league winner.\nPart of a treble winning team (League champs, European Champs and National Cup champs... happens very rarely in football)\n\nBut what are his vulnerabilities? \nHow has he gotten so far as a professional athlete? \nHow does a day in his life look like? \nHow's men's mental health evolving in world football?\n\nA must watch conversation for football fans as well as podcast listeners globally.\n\nThe plan is to further collaborate with @mancity & other premier league clubs. Do spread the word, wish to make football mainstream in our homeland!\n\nWatch now, on @theranveershowpodcast"", ""viewCount"": 0, ""location"": null, ""userTags"": [""ilkayguendogan""]}","{""mediaType"": 8, ""likeCount"": 587483, ""commentCount"": 2603, ""commentText"": ""This one\u2019s for my 17-year-old self.\n\nTo the kid who had dreams so big, no one thought they were possible.\n\nDreams so big, they kept him up all night, buzzing with excitement.\n\nDreams so big, people laughed.\n\nDreams so big, only my parents truly believed in me.\n\nBut here\u2019s the thing about dreams.\n\nIf your dreams don\u2019t scare you, then you\u2019re not dreaming big enough.\n\nAs someone who\u2019s been a huge fan of Ranveer since 2017, this will always be a core memory for me.\n\nThank you @beerbiceps for the incredible conversation. It was amazing discussing mindset, spirituality and health with you.\n\nNext time we meet, it\u2019ll be on my turf.\n\nA hardcore Ranveer x Saket training session. \n\nDeal?"", ""viewCount"": 0, ""location"": null, ""userTags"": [""beerbiceps""]}","{""mediaType"": 2, ""likeCount"": 1625769, ""commentCount"": 5124, ""commentText"": ""Learnt how to work hard from this man & his team, @manchesterunited.\n\nThank you for everything @rioferdy5. The next one will be in India \ud83d\ude4f\ud83c\udffb\u2665\ufe0f"", ""viewCount"": 22768789, ""location"": null, ""userTags"": [""rioferdinandpresents"", ""rioferdy5""]}","{""mediaType"": 8, ""likeCount"": 109384, ""commentCount"": 483, ""commentText"": ""Been a life long Man Utd fan. This is one of the most beautiful days of my career...\n\nMan Utd legend @rioferdy5 appears on @theranveershowpodcast.\n\nSo much love for him as a player. \nEven more love for him as a human being now that I got to know him.\n\nIndia loves Rio Ferdinand. Catch the episode on our YouTube channel, now!\n\n#football #manutd #englishpremierleague\n\nOutfit : @govindamehtaa @thehouseofgovinda"", ""viewCount"": 0, ""location"": {""name"": ""London, Un\u03b9ted Kingdom"", ""address"": ""London "", ""city"": ""London, United Kingdom"", ""has_viewer_saved"": false, ""pk"": 858035584228705, ""short_name"": ""London"", ""facebook_places_id"": 858035584228705, ""external_source"": ""facebook_places"", ""lng"": -0.07939436, ""lat"": 51.474967445}, ""userTags"": [""rioferdy5""]}","{""mediaType"": 8, ""likeCount"": 180602, ""commentCount"": 399, ""commentText"": ""just a chill guy wishing you a chill 2025. \n\nsmile more this year \u2764\ufe0f\u200d\ud83e\ude79"", ""viewCount"": 0, ""location"": null, ""userTags"": [""through_the_glass_eye""]}","{""mediaType"": 2, ""likeCount"": 293918, ""commentCount"": 2264, ""commentText"": ""Dear soul reading this, \nAccording to numerology, 2024 has been a year governed by Saturn. \n\nSaturn tests two aspects of your existence : \n1. Your ability to work hard through storms.\n2. Your ability to stay humble through glory.\n\nSaturn is a task master. Saturn is an examiner.\n\nIt's not been an easy year for me either. I have put my head down and worked through it all.\n\nSome times, while my head was down and working... my eyes teared up with the pressure of being an adult. \n\nSome times while my head was down and working... God gave me moments to smile & breathe.\n\nIt's been a year that's tested me to my last degree of resistance.\n\nIt's a year that's taught me : Faith and belief can overcome the false storms of what we call \""suffering\""\n\nMy knee injury was a gift as much as my national award was.\n\nMy poor mental health was a gift as much as public adulation was.\n\nLife's purpose is to grow. Often through the dungeons of suffering as much as through the dungeons of success.\n\nGet even healthier this year.\nMeditate deeply this year.\nPursue peace this year.\n\nBut whatever you do, believe that God is with you through every step.\n\nHappy 2025, have a blessed one!\n\n2025 - Year of \""Mars\""\n\nPour your intensity into the speed and strength of your work.\nNow overcome your own demons.\nNow grow more easily. \n\n#spirituality #theranveershow #God"", ""viewCount"": 6171589, ""location"": null, ""userTags"": []}","{""mediaType"": 8, ""likeCount"": 420230, ""commentCount"": 2307, ""commentText"": ""Merry Christmas to you all, from Goa. It's been the most eventful Christmas of my life. \n\nGonna be very vulnerable in this write up.\n\nWe're perfectly fine & well now. But yesterday at 6:00 pm or so, my girlfriend and I had to be rescued from a bit of a situation.\n\nWe both love swimming in the open ocean. I've been doing this since I was a kid. \n\nBut yesterday we got swept away by an underwater current. \nThis has happened to me before but I've never been alongside a companion.\n\nIt's easy to swim out of one alone. It's very hard to pull someone out with you.\n\nAfter a 5-10 minute struggle, we called for help and were promptly rescued by a family of 5 swimming nearby.\n\nWe're both good swimmers but the fury of nature is such that it WILL test your limits at some point.\n\nA casual, fun dip in the waves was interrupted by an underwater current that toppled both of us. The next thing we knew was that we were both struggling to stay afloat.\n\nThere was a point during the ordeal where I swallowed a lot of water and started fading away a little bit. That's when I decided to shout for help.\n\nDeep gratitude to the family of the IPS officer husband and IRS officer wife who saved us both.\n\nThis experience left us feeling both blank as well as grateful. We felt the protection of God throughout the incident.\n\nAs we moved into today's Christmas, we're simply full of gratitude for being alive.\n\nAlmost feel like this one life experience has changed my perspective towards living.\n\nWriting this because I've always shared these moments with you all. Full of emotion and gratitude today. A deep thank you and big hugs to each one of you reading this!\n\nLast evening, I decided to call my brother @brother.salvador to convey the Christmas Eve incident. He performed a prayer for us where we thanked Lord Jesus Christ as well as the God above us. \n\nThis has been a very very memorable Goa holiday for me. From discovering secret Murtis at @aliladiwagoa to touching the life-death barrier.\n\nI guess 2025 is going to be more blessed than ever.\n\nWe lived for a reason!\n\nMerry Christmas to you all and to your families. Thank you God, for life! \ud83d\ude4f\ud83c\udffb\ud83d\ude4f\ud83c\udffb\ud83d\ude4f\ud83c\udffb\ud83d\ude4f\ud83c\udffb\u2665\ufe0f"", ""viewCount"": 0, ""location"": {""name"": ""Majorda Beach Goa"", ""address"": ""Goa"", ""city"": """", ""has_viewer_saved"": false, ""pk"": 346957452550637, ""short_name"": ""Majorda Beach Goa"", ""facebook_places_id"": 346957452550637, ""external_source"": ""facebook_places"", ""lng"": 73.90207914999, ""lat"": 15.31030289676}, ""userTags"": []}",technology,"{""mediaType"": 1, ""likeCount"": 776440, ""commentCount"": 38494, ""commentText"": ""N/A"", ""viewCount"": 0, ""location"": null, ""userTags"": [""ranveerallahbadia""]}","Male: 45.99%, Female: 54.01%",539860.6667,26139.16667,385744.2167,0.125111895,1344.013369,260022585.7,390033878.6,57.47690474
Ahsaas Channa,ahsaassy_,ahsaassy_,"I post pictures of myself and random stuff from my life. And sometimes give film and music reccos
Balle!
💌 : ahsaas.channa@collectiveartists.com",Actor,TRUE,TRUE,3879169,3215,2394,"{""mediaType"": 2, ""likeCount"": 6821, ""commentCount"": 16, ""commentText"": ""Denim\u2014it\u2019s a feeling. \n\nShop the new denim drop at your nearest Westside store.\n\n#westsidestores #denim #fashion #trending #newcollection"", ""viewCount"": 157188, ""location"": null, ""userTags"": [""ahsaassy_""]}","{""mediaType"": 2, ""likeCount"": 5872, ""commentCount"": 30, ""commentText"": ""#ELLEDigitalCoverStar: Go behind the scenes with our cover star, Ahsaas Channa (@ahsaassy_), on the sets of our latest digital shoot.\n________________________________________\nOn @ahsaassy_: Goose shoes, Calliope sandals, Veneza sandals, Emily mule and Mindy sandal, all by @bata.india\n________________________________________\nELLE India Editor: Ainee Nizami Ahmedi (@aineenizamiahmedi)\nVideographer: Anurag Ekka (@anurag_ekka)\nLead Stylist: Komal Shetty (@komal_shetty_)\nAsst. Art Director: Alekha Chugani (@alekhachuganii)\nMakeup: Virja Mehta (@makeupbyvirja)\nHair: Akanksha Singh (@hairloom_by_akanksha)\nBookings Coordinator: Anushka Patil (@anushkapatil21)\nAssisted by: Drushti Kadam (drushti_kadam) (styling), Khushi Nagpal (@_khushinagpal) (bookings)\nArtist\u2019s PR: Communique\u0301 Film PR (@communiquefilmpr)\n________________________________________\n#ELLEDigitalCover #AhsaasChanna #Actor"", ""viewCount"": 84716, ""location"": null, ""userTags"": [""ahsaassy_"", ""bata.india""]}","{""mediaType"": 2, ""likeCount"": 15183, ""commentCount"": 50, ""commentText"": ""#ELLEDigitalCoverStar: Ahsaas Channa\u2019s (@ahsaassy_) mother\u2014a single mum juggling acting and raising her\u2014had no grand plan of launching her daughter into films. But Channa was a natural as a youngster, picking up dialogues from the sets her mother worked on. \u201cMy childhood was a mix of school, sets, and studying in between shots. I was the kid who\u2019d disappear for shoots.\u201d Then came \u2018Kabhi Alvida Naa Kehna\u2019 and \u2018My Friend Ganesha,\u2019 and Ahsaas quickly became a familiar face. More at the \ud83d\udd17 in bio.\n________________________________________\nELLE India Editor: Ainee Nizami Ahmedi (@aineenizamiahmedi)\nVideographer: Anurag Ekka (@anurag_ekka)\nLead Stylist: Komal Shetty (@komal_shetty_)\nAsst. Art Director: Alekha Chugani (@alekhachuganii)\nMakeup: Virja Mehta (@makeupbyvirja)\nHair: Akanksha Singh (@hairloom_by_akanksha)\nBookings Coordinator: Anushka Patil (@anushkapatil21)\nWords by: Ekta Sinha (@16ektasinha)\nAssisted by: Drushti Kadam (drushti_kadam) (styling), Khushi Nagpal (@_khushinagpal) (bookings) \nArtist\u2019s PR: Communique\u0301 Film PR (@communiquefilmpr)\n________________________________________\n#ELLEDigitalCover #AhsaasChanna #Actor"", ""viewCount"": 154547, ""location"": null, ""userTags"": [""ahsaassy_"", ""bata.india""]}","{""mediaType"": 8, ""likeCount"": 35150, ""commentCount"": 54, ""commentText"": ""#ELLEDigitalCoverStar: Those who have known Ahsaas Channa (@ahsaassy_) over the years know that the star wears her Swiftie crown proudly, a love affair that began in fifth grade with \u2018Love Story\u2019. \u201cThat was it\u2014I was hooked,\u201d she recalls. For her, Taylor Swift\u2019s music goes far beyond heartbreak anthems. \u201cShe\u2019s written about everything\u2014infidelity, murder, the pandemic, even miscarriage. That\u2019s why she resonates with so many of us.\u201d She adds, \u201cNow everyone\u2019s a Swiftie, but if your favourite song is \u2018Blank Space\u2019 or \u2018August\u2019 and you don\u2019t know what Taylor\u2019s Version means, that\u2019s icky!\u201d she laughs. Head to the \ud83d\udd17 in bio to read the full conversation.\n________________________________________\nOn @ahsaassy_: Mindy sandal by @bata.india \nTada patra gold bralet sheath dress by @aartivijaygupta, Earrings by @romanarsinghaniofficial. \n________________________________________\nELLE India Editor: Ainee Nizami Ahmedi (@aineenizamiahmedi)\nPhotographer: Roy (@leroifoto) (@repp.agency)\nLead Stylist: Komal Shetty (@komal_shetty_)\nAsst. Art Director: Alekha Chugani (@alekhachuganii)\nMakeup: Virja Mehta (@makeupbyvirja)\nHair: Akanksha Singh (@hairloom_by_akanksha)\nBookings Coordinator: Anushka Patil (@anushkapatil21)\nWords by: Ekta Sinha (@16ektasinha)\nAssisted by: Drushti Kadam (drushti_kadam) (styling), Khushi Nagpal (@_khushinagpal) (bookings)\nArtist\u2019s PR: Communique\u0301 Film PR (@communiquefilmpr)\n________________________________________\n#ELLEDigitalCover #AhsaasChanna #Actor"", ""viewCount"": 0, ""location"": null, ""userTags"": [""ahsaassy_"", ""bata.india""]}","{""mediaType"": 8, ""likeCount"": 12082, ""commentCount"": 18, ""commentText"": ""#ELLEDigitalCoverStar: A day on set for the actor varies wildly. \u201cIf it\u2019s a fashion shoot, I love the princess treatment. I sit in the makeup chair, zone out, listen to music, and just exist while everyone works their magic.\u201d But on film sets, it\u2019s a different game. \u201cYou\u2019re in a time crunch, so rehearsals have to be spot on; there\u2019s no room for mistakes.\u201d Head to the \ud83d\udd17 in bio to read the full conversation with Ahsaas Channa (@ahsaassy_). \n ________________________________________\nOn @ahsaassy_: Emily mule by @bata.india\n\nCandy fluff dress by @papadontpreachbyshubhika. Solitare studs by @ishhaara. Sun cross bangles by @simranchhabrajewels. Rainbow spiral cuff, red crystal ball cuff and disco lights cuff, all by @isharya. \n________________________________________\nELLE India Editor: Ainee Nizami Ahmedi (@aineenizamiahmedi)\nPhotographer: Roy (@leroifoto) (@repp.agency)\nLead Stylist: Komal Shetty (@komal_shetty_)\nAsst. Art Director: Alekha Chugani (@alekhachuganii)\nWords by: Ekta Sinha (@16ektasinha)\nMakeup: Virja Mehta (@makeupbyvirja)\nHair: Akanksha Singh (@hairloom_by_akanksha)\nBookings Coordinator: Anushka Patil (@anushkapatil21)\nAssisted by: Drushti Kadam (drushti_kadam) (styling), Khushi Nagpal (@_khushinagpal) (bookings)\nArtist\u2019s PR: Communique\u0301 Film PR (@communiquefilmpr)\n________________________________________\n#ELLEDigitalCover #AhsaasChanna #Actor"", ""viewCount"": 0, ""location"": null, ""userTags"": [""ahsaassy_"", ""bata.india""]}","{""mediaType"": 8, ""likeCount"": 23831, ""commentCount"": 44, ""commentText"": ""#ELLEDigitalCoverStar: Ahsaas Channa (@ahsaassy_) doesn\u2019t just love cinema\u2014she lives for it. A glance at her Letterboxd offers a glimpse into her expansive watchlist, but her top four stand firm: \u2018Yi Yi,\u2019 \u2018Close-Up,\u2019 \u2018An Elephant Sitting Still,\u2019 and \u2018The Truman Show.\u2019 During the lockdown, she set an ambitious goal\u2014to watch 1,000 films. She fell short, wrapping up somewhere in the 700s, but if anything, that only proves the depth of her cinephile devotion. For Channa, movies aren\u2019t just entertainment; they\u2019re a lifelong passion waiting to take shape behind the lens. More at the \ud83d\udd17 in bio.\n________________________________________\nOn @ahsaassy_: Veneza sandals by @bata.india\n\n Tiered champagne tea dress by @rudrakshdwivedi,Viola earrings by @e3kjewelry.\n ________________________________________\nELLE India Editor: Ainee Nizami Ahmedi (@aineenizamiahmedi)\nPhotographer: Roy (@leroifoto) (@repp.agency)\nLead Stylist: Komal Shetty (@komal_shetty_)\nAsst. Art Director: Alekha Chugani (@alekhachuganii)\nMakeup: Virja Mehta (@makeupbyvirja)\nHair: Akanksha Singh (@hairloom_by_akanksha)\nBookings Coordinator: Anushka Patil (@anushkapatil21)\nWords by: Ekta Sinha (@16ektasinha)\nAssisted by: Drushti Kadam (drushti_kadam) (styling), Khushi Nagpal (@_khushinagpal) (bookings)\nArtist\u2019s PR: Communique\u0301 Film PR (@communiquefilmpr)\n________________________________________\n#ELLEDigitalCover #AhsaasChanna #Actor"", ""viewCount"": 0, ""location"": null, ""userTags"": [""ahsaassy_"", ""bata.india""]}","{""mediaType"": 8, ""likeCount"": 54182, ""commentCount"": 68, ""commentText"": ""#ELLEDigitalCoverStar: Ahsaas Channa (@ahsaassy_) is a girl\u2019s girl. She believes in the power of female friendships and has been fortunate to find a solid support system in an industry that can often feel isolating. \u201cIn this industry, you don\u2019t always land in the right circle, but when you do, it\u2019s everything,\u201d she says. Head to the \ud83d\udd17 in bio to read the full conversation with our cover star.\n________________________________________\nOn @ahsaassy_: Calliope sandals by @bata.india.\n.\nBlack embroidered straight skirt, short jacket and ivory corset, all by @nitikagujralofficial. Solitare studs by @ishhaara. Whimsical fantasy ear cuff by @esmecrystals. ________________________________________\nELLE India Editor: Ainee Nizami Ahmedi (@aineenizamiahmedi)\nPhotographer: Roy (@leroifoto) (@repp.agency)\nLead Stylist: Komal Shetty (@komal_shetty_)\nAsst. Art Director: Alekha Chugani (@alekhachuganii)\nMakeup: Virja Mehta (@makeupbyvirja)\nHair: Akanksha Singh (@hairloom_by_akanksha)\nBookings Coordinator: Anushka Patil (@anushkapatil21)\nWords by: Ekta Sinha (@16ektasinha)\nAssisted by: Drushti Kadam (drushti_kadam) (styling), Khushi Nagpal (@_khushinagpal) (bookings) \nArtist\u2019s PR: Communique\u0301 Film PR (@communiquefilmpr)\n________________________________________\n#ELLEDigitalCover #AhsaasChanna #Actor"", ""viewCount"": 0, ""location"": null, ""userTags"": [""ahsaassy_"", ""bata.india""]}","{""mediaType"": 8, ""likeCount"": 18221, ""commentCount"": 52, ""commentText"": ""#ELLEDigitalCoverStar: Child star to digital icon, and now, with her eye on Bollywood, Ahsaas Channa (@ahsaassy_) shows how you can make your way when you get your focus right! Whilst she's establishing her sway over the industry, at the end of the day, she\u2019s just a girl who loves her craft, her playlist, and a good script. And that\u2019s exactly why her fans adore her. \""I was four when I did my first film, \u2018Vaastu Shastra\u2019, with Sushmita Sen. They originally wanted a boy for the part,\u201d she recalls. \u201cBut they loved my audition and asked my mum if I could do it. She was hesitant at first, but then said, \u2018Daisy Irani did it so well, so can you!\u2019 And that\u2019s how it all began.\u201d Head to the \ud83d\udd17 in bio to read the full conversation with our cover star.\n.\nOn @ahsaassy_: Metallic North Star sneakers by @bata.india. \n.\nAurorays swirl lehenga by @shivanandnarresh, Earrings by @romanarsinghaniofficial, Touchwood bangles by @simranchhabrajewels. \n________________________________________\nELLE India Editor: Ainee Nizami Ahmedi (@aineenizamiahmedi)\nPhotographer: Roy (@leroifoto) (@repp.agency)\nLead Stylist: Komal Shetty (@komal_shetty_)\nAsst. Art Director: Alekha Chugani (@alekhachuganii)\nMakeup: Virja Mehta (@makeupbyvirja)\nHair: Akanksha Singh (@hairloom_by_akanksha)\nBookings Coordinator: Anushka Patil (@anushkapatil21)\nWords by: Ekta Sinha (@16ektasinha)\nCover Design: Sakshi Badani (@saaksh.i)\nAssisted by: Drushti Kadam (styling), Khushi Nagpal (@_khushinagpal) (bookings)\nArtist\u2019s PR: Communique\u0301 Film PR (@communiquefilmpr)\n________________________________________\n#ELLEDigitalCover #AhsaasChanna #Actor"", ""viewCount"": 0, ""location"": null, ""userTags"": [""ahsaassy_"", ""bata.india""]}","{""mediaType"": 2, ""likeCount"": 32507, ""commentCount"": 68, ""commentText"": ""Happy birthday to the most beautiful, intelligent, the most wonderful, hardworking and STRONGEST woman I know. Someone who worked every minute to give me and my sister the best life. Raised us single handedly. \nI work towards being half as amazing as you everyday of my life. I really got lucky with bagging the best mother in the world. You deserve so much more appreciation for who you are. I love you so much."", ""viewCount"": 358818, ""location"": null, ""userTags"": [""kulbirbadesron""]}","{""mediaType"": 2, ""likeCount"": 123462, ""commentCount"": 186, ""commentText"": ""Pehle social media tha hi nahi na.."", ""viewCount"": 1524257, ""location"": null, ""userTags"": [""garimayajnik"", ""ahsaassy_"", ""abhinavsharma5""]}","{""mediaType"": 1, ""likeCount"": 54940, ""commentCount"": 92, ""commentText"": ""Beat yo a and hide the Bible if god watchin\u2019"", ""viewCount"": 0, ""location"": null, ""userTags"": []}","{""mediaType"": 2, ""likeCount"": 77138, ""commentCount"": 193, ""commentText"": ""We are fans."", ""viewCount"": 1730156, ""location"": null, ""userTags"": [""kulbirbadesron""]}",technology,"{""mediaType"": 2, ""likeCount"": 6821, ""commentCount"": 16, ""commentText"": ""Denim\u2014it\u2019s a feeling. \n\nShop the new denim drop at your nearest Westside store.\n\n#westsidestores #denim #fashion #trending #newcollection"", ""viewCount"": 157188, ""location"": null, ""userTags"": [""ahsaassy_""]}","Male: 76.66%, Female: 23.34%",38282.41667,72.58333333,26819.46667,0.009887427,1206.584448,80787830.63,121181746,20.82606626
